{
  "schema_version": "0.1.0",
  "architecture_id": "AREF-002",
  "status": "AUTHORITATIVE",
  "supersedes": {
    "architecture_id": "AREF-001",
    "status": "SUPERSEDED DESIGN CANDIDATE / NOT AUTHORITATIVE",
    "path": "specs/AREF-001/",
    "preserved_unmodified": true,
    "manifest_hashed_files": 24,
    "manifest_total_bytes": 237251
  },
  "frozen_against": {
    "repository": "actenon-scan",
    "commit": "b8a6a62308fb2d569b6530f6ecf250e6e4ef6e16",
    "branch": "main",
    "version": "1.5.0"
  },
  "founding_principle": "A consequential effect is a claim to be proved, not a sink to be matched.",

  "vocabularies": {
    "proof_states": {
      "closed": true,
      "members": ["SUPPORTED", "REFUTED", "UNKNOWN", "CONFLICTING", "ERROR"],
      "note": "Requirement 5. ERROR is separate from UNKNOWN: 'we did not find out' and 'our analysis broke' require different responses. CONFLICTING never silently collapses to UNKNOWN."
    },
    "verdicts": {
      "closed": true,
      "members": ["PROVEN_EFFECT", "NO_EFFECT", "ABSTAIN", "ANALYSIS_ERROR"],
      "note": "Requirement 6."
    },
    "obligations": {
      "closed": true,
      "members": ["IMPLEMENTATION", "ACTIVATION", "BOUNDARY", "OPERATION", "PERSISTENCE"],
      "note": "Requirement 7. Independent: none may be inferred from another."
    },
    "descriptors": {
      "closed": true,
      "members": ["TARGET", "CONTROL", "AUTHORITY", "CONDITIONS"],
      "note": "Requirement 8. Retained separately and never obligations."
    },
    "control_sub_descriptors": {
      "closed": true,
      "members": ["TRIGGER_CONTROL", "TARGET_CONTROL", "CONTENT_CONTROL"],
      "note": "Each carries its own proof state. REI-002 measured a fixed-target effect at PROVEN_EFFECT with TRIGGER_CONTROL SUPPORTED and TARGET_CONTROL REFUTED."
    },
    "implementation_candidate_kinds": {
      "closed": true,
      "members": [
        "RESOLVED_LOCAL",
        "RESOLVED_DEPENDENCY_SOURCE",
        "CONTRACT_DECLARED",
        "OPAQUE_EXTERNAL",
        "DYNAMIC_UNRESOLVED",
        "TEST_DOUBLE"
      ],
      "note": "Requirement 3: set-valued. OPAQUE_EXTERNAL is a first-class candidate, not an error; that is what allows a claim to exist for an unseen SDK."
    },
    "selection_states": {
      "closed": true,
      "members": [
        "SINGLE_ESTABLISHED",
        "AGREEMENT_INVARIANT",
        "UNRESOLVED_DIVERGENT",
        "SELECTION_ERROR"
      ],
      "note": "Selection is never performed by severity, danger, name plausibility or recency."
    },
    "admissibility": {
      "closed": true,
      "members": ["PROBATIVE", "HYPOTHESIS_ONLY"],
      "note": "Exactly two classes. A third, intermediate class would let name-derived signals drift into verdicts and would make the anti-gaming criteria unmeasurable."
    },
    "polarity": {
      "closed": true,
      "members": ["POSITIVE", "NEGATIVE"]
    },
    "ladder_tiers": {
      "closed": true,
      "members": ["L0", "L1", "L2", "L3", "L4", "L5", "L6", "L7", "L8"],
      "note": "Requirement 12. L8 is a terminal ABSTAIN state, not an evidence source."
    },
    "stop_reasons": {
      "closed": true,
      "members": [
        "SETTLED",
        "NO_FURTHER_TIER",
        "TIER_UNAVAILABLE",
        "BUDGET_EXHAUSTED",
        "ACQUISITION_ERROR",
        "CLAIM_NOT_INVESTIGATED",
        "CYCLE",
        "MAX_TIER_REACHED",
        "CANDIDATE_LIMIT"
      ],
      "note": "TIER_UNAVAILABLE and BUDGET_EXHAUSTED are never merged: the first is a property of the repository, the second of our configuration."
    },
    "budget_names": {
      "closed": true,
      "members": [
        "max_ladder_tier",
        "max_dependency_hops",
        "max_files_opened",
        "max_bytes_read",
        "max_wall_ms_per_claim",
        "max_claims_investigated",
        "max_implementation_candidates"
      ],
      "note": "Requirement 13."
    },
    "contradiction_resolutions": {
      "closed": true,
      "members": ["UNRESOLVED", "RESOLVED_IMPLEMENTATION_PRECEDENCE"],
      "note": "Requirement 14. Recency, severity, safety, tier rank, packet strength, majority vote and discarding a packet are all prohibited resolutions."
    }
  },

  "obligations": [
    {
      "id": "IMPLEMENTATION",
      "question": "Which code actually runs?",
      "settled_by_tiers": ["L0", "L1", "L2", "L3", "L4", "L5"],
      "can_be_refuted": false,
      "prohibitions": [
        {
          "prohibition": "The dangerous implementation is never selected because it is dangerous.",
          "source": "REI-002"
        },
        {
          "prohibition": "A callee name never establishes which implementation runs.",
          "source": "requirement 10; REI-001B lexical-adversary invariance"
        },
        {
          "prohibition": "The presence or absence of a sink rule never establishes or excludes a candidate.",
          "source": "requirements 2 and 11"
        }
      ]
    },
    {
      "id": "ACTIVATION",
      "question": "Is this invocation executed when the capability runs?",
      "settled_by_tiers": ["L0", "L1"],
      "can_be_refuted": true,
      "prohibitions": [
        { "prohibition": "Construction is not activation.", "source": "REI-002" },
        { "prohibition": "Import is not activation.", "source": "REI-002" },
        {
          "prohibition": "Conditional execution is not refutation; a guard is recorded as a CONDITIONS descriptor.",
          "source": "AREF-002 proof_obligations.md 2.2"
        }
      ]
    },
    {
      "id": "BOUNDARY",
      "question": "Does the effect leave the analysed state into an external system?",
      "settled_by_tiers": ["L0", "L1", "L2", "L5", "L6", "L7"],
      "can_be_refuted": true,
      "prohibitions": [
        {
          "prohibition": "HTTP or network dispatch may support ACTIVATION and BOUNDARY but never establishes OPERATION or PERSISTENCE.",
          "source": "requirement 9; REI-002 — every carrier used POST, yet an identical-source pair changed classification solely because the operation contract changed"
        },
        {
          "prohibition": "External boundary does not imply persistence.",
          "source": "REI-002"
        }
      ]
    },
    {
      "id": "OPERATION",
      "question": "Is the operation contract a mutation rather than an observation?",
      "settled_by_tiers": ["L1", "L5", "L6", "L7"],
      "can_be_refuted": true,
      "prohibitions": [
        {
          "prohibition": "The HTTP method never establishes the operation.",
          "source": "REI-002"
        },
        {
          "prohibition": "An identifier never establishes the operation; names generate hypotheses only.",
          "source": "requirement 10"
        },
        {
          "prohibition": "Unknown SQL, command or operation semantics yield UNKNOWN; keyword-prefix inference on an unparsed statement is prohibited.",
          "source": "REI-002 — abstain on unknown SQL semantics"
        }
      ]
    },
    {
      "id": "PERSISTENCE",
      "question": "Does the mutation outlive the request?",
      "settled_by_tiers": ["L1", "L5", "L6", "L7"],
      "can_be_refuted": true,
      "prohibitions": [
        { "prohibition": "Dispatch is not persistence.", "source": "REI-002" },
        { "prohibition": "Persistence is independent of transport.", "source": "REI-002" },
        { "prohibition": "Guaranteed rollback refutes persistence.", "source": "REI-002" },
        {
          "prohibition": "Unknown commit versus rollback preserves uncertainty: UNKNOWN, never SUPPORTED.",
          "source": "REI-002"
        }
      ]
    }
  ],

  "descriptors": [
    {
      "id": "TARGET",
      "is_obligation": false,
      "gates_verdict": false,
      "note": "Coordinates with per-field resolution state plus scope. A fully unresolved target does not weaken the verdict."
    },
    {
      "id": "CONTROL",
      "is_obligation": false,
      "gates_verdict": false,
      "note": "Split into TRIGGER_CONTROL, TARGET_CONTROL and CONTENT_CONTROL because REI-002 measured a case where they disagreed."
    },
    {
      "id": "AUTHORITY",
      "is_obligation": false,
      "gates_verdict": false,
      "note": "Authority is not an obligation of effect (REI-002). An authorised effect is still an effect; an unauthorised read is still not an effect."
    },
    {
      "id": "CONDITIONS",
      "is_obligation": false,
      "gates_verdict": false,
      "note": "Guards, flags and branch predicates. Recorded, never used to refute ACTIVATION."
    }
  ],

  "effect_classes": [
    {
      "id": "EXTERNAL_PERSISTENT_STATE_EFFECT",
      "status": "POPULATED_V1",
      "necessary_obligations": [
        "IMPLEMENTATION",
        "ACTIVATION",
        "BOUNDARY",
        "OPERATION",
        "PERSISTENCE"
      ],
      "requires_persistence": "yes",
      "note": "Requirement 18: the only class populated in v1."
    },
    {
      "id": "MESSAGE_EMISSION_EFFECT",
      "status": "DECLARED_UNPOPULATED",
      "necessary_obligations": [
        "IMPLEMENTATION",
        "ACTIVATION",
        "BOUNDARY",
        "OPERATION",
        "DELIVERY_ATTEMPT"
      ],
      "requires_persistence": "no",
      "note": "Not implemented in v1; DELIVERY_ATTEMPT may not be read by the v1 verdict function. A message send is not a persistent-state mutation."
    },
    {
      "id": "VALUE_TRANSFER_EFFECT",
      "status": "DECLARED_UNPOPULATED",
      "necessary_obligations": [
        "IMPLEMENTATION",
        "ACTIVATION",
        "BOUNDARY",
        "OPERATION",
        "SETTLEMENT"
      ],
      "requires_persistence": "no",
      "note": "Payments. Not implemented in v1; SETTLEMENT may not be read by the v1 verdict function."
    },
    {
      "id": "CODE_EXECUTION_EFFECT",
      "status": "DECLARED_UNPOPULATED",
      "necessary_obligations": [
        "IMPLEMENTATION",
        "ACTIVATION",
        "EXECUTION_SEMANTICS"
      ],
      "requires_persistence": "no",